{
  "approvals": [
    {
      "acs_id": "ACS-D01-01",
      "approval_time": "2026-03-02T15:00:00Z",
      "approver": "forum.chair_treasury",
      "forum": "treasury_governance_forum"
    }
  ],
  "assessment_ref": {
    "assessment_id": "ASSESSMENT-CASE-D",
    "binding_id": "VB-CASE-D-1.0"
  },
  "catalog_ref": {
    "catalog_id": "K-CASE-D",
    "version": "1.0"
  },
  "disposition_decisions": [
    {
      "decided_by": "business.head_treasury_operations",
      "decision_time": "2026-03-02T15:00:00Z",
      "rationale": "The risk has an approved catalog observable evaluable at authorization time on the sole authorized external action path.",
      "risk_id": "D-01",
      "status": "runtime"
    },
    {
      "decided_by": "exec.head_of_treasury",
      "decision_time": "2026-03-02T15:00:00Z",
      "rationale": "Emergency-exception path explicitly disabled (spec D2); residual risk accepted with an authorized non-runtime (manual governance process) treatment.",
      "risk_id": "D-02",
      "status": "accepted"
    }
  ],
  "judgment_id": "J-CASE-D-CCS0",
  "selections": [
    {
      "acs_id": "ACS-D01-01",
      "event_type": "dual_authorization_check",
      "rationale": "Dual authorization is a structural check over a signed registry artifact; T-DUAL-AUTH is the approved template. Ordinary path, present and decisive across every CCS variant.",
      "risk_id": "D-01",
      "selected_by": "business.head_treasury_operations",
      "selection_id": "JD-CCS0-SEL-001",
      "selection_time": "2026-03-02T15:00:00Z",
      "template_id": "T-DUAL-AUTH"
    }
  ],
  "signature": {
    "algorithm": "Ed25519",
    "domain": "judgment_record",
    "key_id": "key.governance_forum_b",
    "payload_hash": "bf9f3f9ffed758adb142eb12145205c2f93ae6f17c18eade9d53497f81a5327d",
    "signature_b64": "o5naCf2WzjcksY8uUEvyzqX3SblS9VV2nkScaFJbnTfn5efywa1wUVg5gH0xoqMb989Y1bvXzibaxrwbTYWmCA==",
    "signing_time": "2026-03-02T15:08:00Z"
  },
  "version": "1.0"
}
